text,company,form,section,file
"RISK FACTORS. The Company's business, results of operations and financial condition can be adversely affected by several factors. Competition: The markets for the Company’s products and services are highly competitive and subject to rapid technological change. The Company faces significant competition from other providers of mobile communication devices, personal computers, and digital content and services. Supply Chain: The Company relies on single-source suppliers for certain components and outsourcing partners, many of whom are located outside the U.S. Disruption in supply chain due to geopolitical tensions, natural disasters, or public health issues could impact production. Intellectual Property: Third parties may claim that the Company's products infringe their intellectual property rights, leading to costly litigation or loss of license. ITEM 7. MD&A. Net sales were $383,285 million in 2023, compared to $394,328 million in 2022. The decrease in net sales was primarily due to lower sales of iPhones and Macs. Gross margin was 44.1% in 2023, compared to 43.3% in 2022, driven by favorable product mix and cost savings.",Apple,10-K,risk_factors,Apple_10-K_2024-10-31.txt
"RISK FACTORS. Our performance depends heavily on the health of global financial markets. Market Volatility: Declines in market volume, asset prices, or liquidity can reduce our trading revenues and investment banking fees. Regulatory Compliance: We are subject to extensive regulation and supervision. Failure to comply can result in substantial fines and restrictions. Underwriting Risks: We face risk of losses when underwriting debt or equity offerings if we are unable to resell the securities to investors. ITEM 7. MD&A. Net revenues were $46.25 billion for 2023, down 2% compared to $47.37 billion for 2022. Net income was $8.52 billion, down 24% compared to $11.26 billion for 2022. The decrease reflected lower revenues in Investment Banking and Asset Management.",Goldman,10-K,risk_factors,Goldman_10-K_2024-03-01.txt
"RISK FACTORS. Our business is sensitive to macroeconomic and geopolitical factors. Interest Rates: Changes in monetary policy and interest rates by the Federal Reserve affect our net interest income (NII) and net interest margin. Rapidly rising or falling rates can create asset-liability mismatches. Credit Risk: Economic downturns can increase defaults on consumer and commercial loans, leading to higher provisions for credit losses. Cybersecurity: We are a frequent target of cyberattacks. Any system breach could compromise customer data and disrupt banking operations. ITEM 7. MD&A. Net income for 2023 was $49.6 billion, compared with $37.7 billion in 2022. Net interest income was $89.3 billion, up 34% driven by higher rates. Noninterest expense was $82.0 billion, up 8% due to higher compensation and First Republic integration costs.",JPMorgan,10-K,risk_factors,JPMorgan_10-K_2024-03-01.txt
"Our business is sensitive to macroeconomic and geopolitical factors. Interest Rates: Changes in monetary policy and interest rates by the Federal Reserve affect our net interest income (NII) and net interest margin. Rapidly rising or falling rates can create asset-liability mismatches. Credit Risk: Economic downturns can increase defaults on consumer and commercial loans, leading to higher provisions for credit losses. Cybersecurity: We are a frequent target of cyberattacks. Any system breach could compromise customer data and disrupt banking operations. ITEM 7. MD&A. Net income for 2023 was $49.6 billion, compared with $37.7 billion in 2022. Net interest income was $89.3 billion, up 34% driven by higher rates. Noninterest expense was $82.0 billion, up 8% due to higher compensation and First Republic integration costs.",JPMorgan,10-K,business,JPMorgan_10-K_2024-03-01.txt
"RISK FACTORS. Our business is subject to significant risks. Cloud Services: We make significant investments in cloud infrastructure and security. Any security breach or service outage in Azure could damage our reputation and lead to loss of customers. Artificial Intelligence: We are integrating generative AI technologies into our products. AI models may produce inaccurate, biased, or harmful outputs, leading to legal liability and reputational harm. Competition: We compete in highly dynamic markets, facing competition from established tech giants and niche cloud and software providers. ITEM 7. MD&A. Revenue was $211.9 billion in fiscal year 2023, an increase of 7% compared to fiscal year 2022. Net income was $72.4 billion, down slightly from $72.7 billion in the prior year. The growth was driven by Microsoft Cloud, which grew 22% to $111.6 billion.",Microsoft,10-K,risk_factors,Microsoft_10-K_2024-07-28.txt
"Our business is subject to significant risks. Cloud Services: We make significant investments in cloud infrastructure and security. Any security breach or service outage in Azure could damage our reputation and lead to loss of customers. Artificial Intelligence: We are integrating generative AI technologies into our products. AI models may produce inaccurate, biased, or harmful outputs, leading to legal liability and reputational harm. Competition: We compete in highly dynamic markets, facing competition from established tech giants and niche cloud and software providers. ITEM 7. MD&A. Revenue was $211.9 billion in fiscal year 2023, an increase of 7% compared to fiscal year 2022. Net income was $72.4 billion, down slightly from $72.7 billion in the prior year. The growth was driven by Microsoft Cloud, which grew 22% to $111.6 billion.",Microsoft,10-K,business,Microsoft_10-K_2024-07-28.txt
"RISK FACTORS. Our business is characterized by rapid technological cycles. AI Demand and Supply: We are experiencing explosive demand for our Hopper and Blackwell GPU architectures for AI workloads. Our ability to meet this demand depends on chip manufacturing capacity at TSMC. Any manufacturing bottleneck or disruption could impact our sales. Export Controls: The US government has imposed restrictions on export of high-performance chips to certain countries, including China. These restrictions could harm our financial results. Competition: We face competition from other chipmakers, cloud service providers developing their own silicon, and startup companies. ITEM 7. MD&A. Revenue for fiscal year 2024 was $60.9 billion, up 126% from $27.0 billion in fiscal year 2023. Data Center revenue was $47.5 billion, up 217% from the prior year, driven by broad-based demand for LLM and generative AI. Gross margin increased to 72.7% from 56.9% in the prior year.",NVIDIA,10-K,risk_factors,NVIDIA_10-K_2024-02-15.txt
"Our business is characterized by rapid technological cycles. AI Demand and Supply: We are experiencing explosive demand for our Hopper and Blackwell GPU architectures for AI workloads. Our ability to meet this demand depends on chip manufacturing capacity at TSMC. Any manufacturing bottleneck or disruption could impact our sales. Export Controls: The US government has imposed restrictions on export of high-performance chips to certain countries, including China. These restrictions could harm our financial results. Competition: We face competition from other chipmakers, cloud service providers developing their own silicon, and startup companies. ITEM 7. MD&A. Revenue for fiscal year 2024 was $60.9 billion, up 126% from $27.0 billion in fiscal year 2023. Data Center revenue was $47.5 billion, up 217% from the prior year, driven by broad-based demand for LLM and generative AI. Gross margin increased to 72.7% from 56.9% in the prior year.",NVIDIA,10-K,business,NVIDIA_10-K_2024-02-15.txt
